{"actor_id":"fixture-release-owner-actor","approval_id":"fixture-system-feature-mapping-approval-release-owner","approved_at":"2026-06-01T12:00:00Z","artifact_metadata":{"classification":"SYNTHETIC_FIXTURE","evidence_claim":"NOT_EVIDENCE_OR_PASS","fixture_notice":"SYNTHETIC EXAMPLE ONLY; NOT EVIDENCE; NOT A PASS VERDICT"},"candidate_subject_sha256":"a16fc8fa3f627c377059929005ffdfab1e1f1d1b8fc4052459b7cd6b2b1f247a","decision":"APPROVED","evidence_refs":[{"artifact_id":"fixture-mapping-approval-evidence-release-owner","artifact_path":"support/mapping-approval-evidence-release-owner.json","artifact_sha256":"fc13008127ba2e91131c27f842abf05c7c589498e0b0d79efc18804a6634ee1a","revision":1,"schema":"ylx.mapping-approval-evidence.v1"}],"natural_person_id":"fixture-release-owner-person","owner_assignment_ref":{"artifact_id":"fixture-owner-assignment-r1","artifact_path":"valid/owner-assignment.json","artifact_sha256":"602ba552f113d6403c4a07e42982d2c035c9b52e64dfc595158629d486359740","revision":1,"schema":"ylx.owner-assignment.v1"},"role_slot":"release-owner","schema":"ylx.system-feature-mapping-approval.v1"}